{
  "schema_version": "0.1.0",
  "revision_id": "prv-synthetic-r5-001",
  "judgment_id": "jdg-synthetic-r5-001",
  "claim_id": "clm-synthetic-r2-001",
  "new_evidence_ids": [
    "evd-synthetic-001"
  ],
  "refuting_evidence_ids": [],
  "source_reputation_refs": [
    "rep-synthetic-wire-diplomacy-behavior"
  ],
  "counterevidence_assessment_ids": [
    "hya-synthetic-r3-001"
  ],
  "prior_state": {
    "claim_grade": "B",
    "finding_summary": "Synthetic hypothesis remained unconfirmed."
  },
  "posterior_state": {
    "claim_grade": "A",
    "finding_summary": "Synthetic primary evidence confirmed the narrow factual claim."
  },
  "direction": "strengthen",
  "rationale": [
    "Synthetic primary evidence became available.",
    "Counterevidence did not trigger falsification."
  ],
  "created_at": "2026-08-31T05:00:00Z",
  "sensitivity": "public"
}
